Athlete,Gender,Country,Country Code,Year,City,Sport,Event,Medal,Multiple Events
Chi Man-hsien,M,Chinese Taipei,TPE,1988,Seoul,Wrestling,"Wrestling Men's Middleweight, Freestyle",No medal,False
Hour Jiunn-yih,M,Chinese Taipei,TPE,1988,Seoul,Wrestling,"Wrestling Men's Light-Flyweight, Freestyle",No medal,False
Hsu Chin-hsiung,M,Chinese Taipei,TPE,1972,Munich,Wrestling,"Wrestling Men's Bantamweight, Freestyle",No medal,False
Huang Chien-lung,M,Chinese Taipei,TPE,1988,Seoul,Wrestling,"Wrestling Men's Featherweight, Freestyle",No medal,False
Lo Chao-cheng,M,Chinese Taipei,TPE,1988,Seoul,Wrestling,"Wrestling Men's Flyweight, Freestyle",No medal,False
Lou Wie-ki,M,Chinese Taipei,TPE,1984,Los Angeles,Wrestling,"Wrestling Men's Flyweight, Freestyle",No medal,False
