Athlete,Gender,Country,Country Code,Year,City,Sport,Event,Medal,Discipline,Event Code,Multiple Events
Stipe Damjanovi,M,Croatia,CRO,1992,Barcelona,Wrestling,"Wrestling Men's Heavyweight, Greco-Roman",No medal,Wrestling,WRF,True
Stipe Damjanovi,M,Croatia,CRO,1996,Atlanta,Wrestling,"Wrestling Men's Heavyweight, Greco-Roman",No medal,Wrestling,WRF,True
Boo Starevi,M,Croatia,CRO,2016,Rio de Janeiro,Wrestling,"Wrestling Men's Middleweight, Greco-Roman",No medal,Wrestling,WRF,False
Nenad Ugaj,M,Croatia,CRO,2012,London,Wrestling,"Wrestling Men's Light-Heavyweight, Greco-Roman",No medal,Wrestling,WRF,False
Neven Ugaj,M,Croatia,CRO,2012,London,Wrestling,"Wrestling Men's Middleweight, Greco-Roman",No medal,Wrestling,WRF,False
Ivan Huklek,M,Croatia,CRO,2020,Tokyo,Wrestling,Men's Greco-Roman 87kg,No medal,Men's,WRF,False
Bozo Starcevic,M,Croatia,CRO,2020,Tokyo,Wrestling,Men's Greco-Roman 77kg,No medal,Men's,WRF,False
