Athlete,Gender,Country,Country Code,Year,City,Sport,Event,Medal,Multiple Events
Marios Georgiou,M,Cyprus,CYP,2016,Rio de Janeiro,Gymnastics,Gymnastics Men's Individual All-Around,No medal,True
Marios Georgiou,M,Cyprus,CYP,2016,Rio de Janeiro,Gymnastics,Gymnastics Men's Floor Exercise,No medal,True
Marios Georgiou,M,Cyprus,CYP,2016,Rio de Janeiro,Gymnastics,Gymnastics Men's Parallel Bars,No medal,True
Marios Georgiou,M,Cyprus,CYP,2016,Rio de Janeiro,Gymnastics,Gymnastics Men's Horizontal Bar,No medal,True
Marios Georgiou,M,Cyprus,CYP,2016,Rio de Janeiro,Gymnastics,Gymnastics Men's Rings,No medal,True
Marios Georgiou,M,Cyprus,CYP,2016,Rio de Janeiro,Gymnastics,Gymnastics Men's Pommelled Horse,No medal,True
