Athlete,Gender,Country,Country Code,Year,City,Sport,Event,Medal,Multiple Events
Bedopassa Djonde,M,Guinea Bissau,GBS,2016,Rio de Janeiro,Wrestling,"Wrestling Men's Heavyweight, Freestyle",No medal,False
Talata Embalo,M,Guinea Bissau,GBS,1996,Atlanta,Wrestling,"Wrestling Men's Bantamweight, Freestyle",No medal,True
Talata Embalo,M,Guinea Bissau,GBS,2000,Sydney,Wrestling,"Wrestling Men's Featherweight, Freestyle",No medal,True
Augusto Midana,M,Guinea Bissau,GBS,2008,Beijing,Wrestling,"Wrestling Men's Middleweight, Freestyle",No medal,True
Augusto Midana,M,Guinea Bissau,GBS,2012,London,Wrestling,"Wrestling Men's Middleweight, Freestyle",No medal,True
Augusto Midana,M,Guinea Bissau,GBS,2016,Rio de Janeiro,Wrestling,"Wrestling Men's Middleweight, Freestyle",No medal,True
