Athlete,Gender,Country,Country Code,Year,City,Sport,Event,Medal,Multiple Events
Fatmeh-Nazli Makou,F,Iran,IRI,1964,Tokyo,Athletics,Athletics Women's High Jump,No medal,False
Juliette (-guevrekian),F,Iran,IRI,1964,Tokyo,Athletics,Athletics Women's Shot Put,No medal,True
Juliette (-guevrekian),F,Iran,IRI,1964,Tokyo,Athletics,Athletics Women's Discus Throw,No medal,True
Leyla Rajabi,F,Iran,IRI,2012,London,Athletics,Athletics Women's Shot Put,No medal,True
Leyla Rajabi,F,Iran,IRI,2016,Rio de Janeiro,Athletics,Athletics Women's Shot Put,No medal,True
Simin Safamehr,F,Iran,IRI,1964,Tokyo,Athletics,Athletics Women's 100 metres,No medal,True
Simin Safamehr,F,Iran,IRI,1964,Tokyo,Athletics,Athletics Women's Long Jump,No medal,True
Fasihi Farzaneh,F,Iran,IRI,2020,Tokyo,Athletics,Women's 100m,No medal,False
