Athlete,Gender,Country,Country Code,Year,City,Sport,Event,Medal,Discipline,Event Code,Multiple Events
Lamachi Elimu,M,Kenya,KEN,1988,Seoul,Wrestling,"Wrestling Men's Flyweight, Greco-Roman",No medal,Wrestling,WRF,True
Lamachi Elimu,M,Kenya,KEN,1988,Seoul,Wrestling,"Wrestling Men's Flyweight, Freestyle",No medal,Wrestling,WRF,True
Waruingi Kimani,M,Kenya,KEN,1988,Seoul,Wrestling,"Wrestling Men's Bantamweight, Freestyle",No medal,Wrestling,WRF,False
Maisiba Obwoge,M,Kenya,KEN,1988,Seoul,Wrestling,"Wrestling Men's Heavyweight, Greco-Roman",No medal,Wrestling,WRF,True
Maisiba Obwoge,M,Kenya,KEN,1988,Seoul,Wrestling,"Wrestling Men's Heavyweight, Freestyle",No medal,Wrestling,WRF,True
Kiptoo Salbei,M,Kenya,KEN,1988,Seoul,Wrestling,"Wrestling Men's Lightweight, Greco-Roman",No medal,Wrestling,WRF,True
Kiptoo Salbei,M,Kenya,KEN,1988,Seoul,Wrestling,"Wrestling Men's Lightweight, Freestyle",No medal,Wrestling,WRF,True
