Athlete,Gender,Country,Country Code,Year,City,Sport,Event,Medal,Multiple Events
Samba Adama,M,Mauritania,MTN,1988,Seoul,Wrestling,"Wrestling Men's Light-Heavyweight, Greco-Roman",No medal,True
Samba Adama,M,Mauritania,MTN,1988,Seoul,Wrestling,"Wrestling Men's Light-Heavyweight, Freestyle",No medal,True
Mamadou Diallo,M,Mauritania,MTN,1984,Los Angeles,Wrestling,"Wrestling Men's Light-Heavyweight, Freestyle",No medal,False
Salem Habib,M,Mauritania,MTN,1988,Seoul,Wrestling,"Wrestling Men's Welterweight, Freestyle",No medal,False
Babacar Sar,M,Mauritania,MTN,1988,Seoul,Wrestling,"Wrestling Men's Heavyweight, Freestyle",No medal,False
Oumar Sy,M,Mauritania,MTN,1984,Los Angeles,Wrestling,"Wrestling Men's Heavyweight, Freestyle",No medal,True
Oumar Sy,M,Mauritania,MTN,1988,Seoul,Wrestling,"Wrestling Men's Heavyweight, Greco-Roman",No medal,True
