Athlete,Gender,Country,Country Code,Year,City,Sport,Event,Medal,Multiple Events
Naima El-rhouati,F,Morocco,MAR,1996,Atlanta,Gymnastics,Gymnastics Women's Individual All-Around,No medal,True
Naima El-rhouati,F,Morocco,MAR,1996,Atlanta,Gymnastics,Gymnastics Women's Floor Exercise,No medal,True
Naima El-rhouati,F,Morocco,MAR,1996,Atlanta,Gymnastics,Gymnastics Women's Horse Vault,No medal,True
Naima El-rhouati,F,Morocco,MAR,1996,Atlanta,Gymnastics,Gymnastics Women's Uneven Bars,No medal,True
Naima El-rhouati,F,Morocco,MAR,1996,Atlanta,Gymnastics,Gymnastics Women's Balance Beam,No medal,True
