Athlete,Gender,Country,Country Code,Year,City,Sport,Event,Medal,Multiple Events
Augusto Aramburu,M,Peru,PER,2004,Athina,Sailing,Sailing Mixed One Person Dinghy,No medal,False
Luis Schwarz,M,Peru,PER,2000,Sydney,Sailing,Sailing Mixed One Person Dinghy,No medal,False
Stefano Mola,M,Peru,PER,2016,Rio de Janeiro,Sailing,Sailing Men's One Person Dinghy,No medal,False
Stefano Peschiera,M,Peru,PER,2020,Tokyo,Sailing,Men's One Person Dinghy - Laser,No medal,True
Stefano Peschiera,M,Peru,PER,2024,Paris,Sailing,Men's Dinghy,Bronze,True
