Athlete,Gender,Country,Country Code,Year,City,Sport,Event,Medal,Multiple Events
E. Seminario-),F,Peru,PER,1968,Mexico City,Shooting,"Shooting Mixed Small-Bore Rifle, Prone, 50 metres",No medal,True
E. Seminario-),F,Peru,PER,1972,Munich,Shooting,"Shooting Mixed Small-Bore Rifle, Prone, 50 metres",No medal,True
Gladys Baldwin,F,Peru,PER,1984,Los Angeles,Shooting,"Shooting Women's Small-Bore Rifle, Three Positions, 50 metres",No medal,False
Daniella Borda,F,Peru,PER,2024,Paris,Shooting,Skeet Women,No medal,True
Daniella Borda,F,Peru,PER,2024,Paris,Shooting,Skeet Mixed Team,No medal,True
