Athlete,Gender,Country,Country Code,Year,City,Sport,Event,Medal,Multiple Events
Luk Baba,M,Slovakia,SVK,2004,Athina,Rowing,Rowing Men's Lightweight Double Sculls,No medal,False
Ondrej Hamblek,M,Slovakia,SVK,1996,Atlanta,Rowing,Rowing Men's Double Sculls,No medal,False
ubo Podstupka,M,Slovakia,SVK,2004,Athina,Rowing,Rowing Men's Lightweight Double Sculls,No medal,False
Jn Ika,M,Slovakia,SVK,1996,Atlanta,Rowing,Rowing Men's Double Sculls,No medal,True
Jn Ika,M,Slovakia,SVK,2000,Sydney,Rowing,Rowing Men's Single Sculls,No medal,True
