Athlete,Gender,Country,Country Code,Year,City,Sport,Event,Medal,Multiple Events
Enrique Mndez,M,Uruguay,URU,1968,Mexico City,Shooting,"Shooting Mixed Free Pistol, 50 metres",No medal,False
Rudi Bobenrieth,M,Uruguay,URU,2012,London,Shooting,"Shooting Men's Air Rifle, 10 metres",No medal,False
Luis Mndez,M,Uruguay,URU,2000,Sydney,Shooting,"Shooting Men's Air Pistol, 10 metres",No medal,False
Arturo Canavero,M,Uruguay,URU,1968,Mexico City,Shooting,Shooting Mixed Trap,No medal,False
Fernando Gonzlez,M,Uruguay,URU,1992,Barcelona,Shooting,"Shooting Men's Air Pistol, 10 metres",No medal,False
Walter Barale,M,Uruguay,URU,1968,Mexico City,Shooting,"Shooting Mixed Free Pistol, 50 metres",No medal,False
