Athlete,Gender,Country,Country Code,Year,City,Sport,Event,Medal,Discipline,Event Code,Multiple Events
Jos Bustamente,M,Venezuela,VEN,2008,Beijing,Gymnastics,Gymnastics Men's Individual All-Around,No medal,Gymnastics,GAR,True
Jos Bustamente,M,Venezuela,VEN,2008,Beijing,Gymnastics,Gymnastics Men's Floor Exercise,No medal,Gymnastics,GAR,True
Jos Bustamente,M,Venezuela,VEN,2008,Beijing,Gymnastics,Gymnastics Men's Parallel Bars,No medal,Gymnastics,GAR,True
Jos Bustamente,M,Venezuela,VEN,2008,Beijing,Gymnastics,Gymnastics Men's Horizontal Bar,No medal,Gymnastics,GAR,True
Jos Bustamente,M,Venezuela,VEN,2008,Beijing,Gymnastics,Gymnastics Men's Rings,No medal,Gymnastics,GAR,True
Jos Bustamente,M,Venezuela,VEN,2008,Beijing,Gymnastics,Gymnastics Men's Pommelled Horse,No medal,Gymnastics,GAR,True
